{
  "$schema": "./project-manifest.schema.json",
  "schemaVersion": "1.0",
  "name": "appmanager-lite",
  "version": "0.1.0",
  "description": "Self-hosted landing portal: a single home page with quick access to each team's applications, plus authentication, user and team management, and self-service application management with administrator approval.",
  "license": "See LICENSE",
  "repository": "https://github.com/Mizton-Labs/AppManager-Lite",
  "generatedFrom": "Hand-maintained from source; update alongside structural, API, config, or data-model changes.",
  "architecture": {
    "summary": "A FastAPI + SQLite backend exposes a JSON API under /api and also serves the built React single-page app. The frontend is a Vite-built SPA that uses relative URLs so one build runs at the site root or behind a subpath reverse proxy.",
    "style": "monorepo, single deployable (backend serves the frontend)",
    "runtimeTopology": "One uvicorn process serves /api and the SPA; SQLite is the datastore; an optional remote nginx is configured over SSH to publish local-alias applications.",
    "auth": "Argon2id password hashing, optional OIDC/OAuth2 and SAML 2.0 SSO, server-side sessions, HttpOnly + SameSite=Strict + Secure session cookie, and an X-CSRF-Token header on state-changing requests. Roles (admin, user) and team membership are enforced server-side."
  },
  "entrypoints": {
    "backend": "backend/app/main.py:app (ASGI app via app.main:app)",
    "frontend": "frontend/src/main.tsx",
    "cli": "./appmanager-lite"
  },
  "components": [
    {
      "id": "backend",
      "type": "backend",
      "path": "backend",
      "description": "FastAPI application: JSON API under /api, SQLite persistence, auth/sessions, audit log, reverse-proxy automation, and SPA hosting.",
      "language": "Python",
      "runtime": "Python >=3.11",
      "framework": "FastAPI",
      "entrypoint": "backend/app/main.py:app",
      "keyModules": [
        { "path": "backend/app/main.py", "role": "App factory, lifespan, security headers, SPA mounting, /api/health, router wiring." },
        { "path": "backend/app/config.py", "role": "Runtime configuration from APP_* environment variables." },
        { "path": "backend/app/db.py", "role": "SQLite connection, schema bootstrap, and additive idempotent migrations." },
        { "path": "backend/app/repository.py", "role": "Parameterized data-access helpers for users, teams, applications, settings, audit." },
        { "path": "backend/app/schemas.py", "role": "Pydantic request/response models and field validation (the API contract)." },
        { "path": "backend/app/deps.py", "role": "Dependencies: get_db, get_current_user, require_admin, verify_csrf." },
        { "path": "backend/app/sessions.py", "role": "Server-side session and CSRF token management." },
        { "path": "backend/app/sso.py", "role": "OIDC/SAML SSO provider resolution, flow-state storage, token/assertion handling, and user linking." },
        { "path": "backend/app/security.py", "role": "Argon2id hashing and password generation." },
        { "path": "backend/app/audit.py", "role": "Audit-trail writer (categories: application, user, system)." },
        { "path": "backend/app/teams.py", "role": "Team slug helper (teams are administrator-managed; none are seeded)." },
        { "path": "backend/app/reverse_proxy.py", "role": "Render and push application aliases to a remote nginx over SSH." },
        { "path": "backend/app/logging_config.py", "role": "Consolidated logging configuration." },
        { "path": "backend/app/routers/auth.py", "role": "Session, local login, SSO login/callback, logout, and own-password endpoints." },
        { "path": "backend/app/routers/users.py", "role": "User management and the readable team list (GET /api/teams)." },
        { "path": "backend/app/routers/applications.py", "role": "Application CRUD, approval workflow, and reverse-proxy push/retry." },
        { "path": "backend/app/routers/settings.py", "role": "Reverse-proxy and branding settings plus team CRUD/reorder." },
        { "path": "backend/app/routers/audit.py", "role": "Audit-log query endpoint." },
        { "path": "backend/tests", "role": "pytest suite (API behavior, migrations, security, nginx)." }
      ]
    },
    {
      "id": "frontend",
      "type": "frontend",
      "path": "frontend",
      "description": "React + TypeScript single-page app built with Vite. One build runs under any deployment prefix; the backend injects a matching <base href> at serve time.",
      "language": "TypeScript",
      "runtime": "Node.js + npm",
      "framework": "React 18 + react-router",
      "entrypoint": "frontend/src/main.tsx",
      "keyModules": [
        { "path": "frontend/src/App.tsx", "role": "Top-level auth/session bootstrap and routing shell selection." },
        { "path": "frontend/src/api.ts", "role": "Typed API client; attaches CSRF on non-GET requests." },
        { "path": "frontend/src/types.ts", "role": "Shared TypeScript types for API entities." },
        { "path": "frontend/src/branding.ts", "role": "Configurable app name/logo and source repository URL." },
        { "path": "frontend/src/teams.ts", "role": "Team URL-slug helpers (team list is data-driven from the API)." },
        { "path": "frontend/src/teamIcons.ts", "role": "Bundled team-icon catalogue manifest (generic-IT and cybersecurity sets) and default." },
        { "path": "frontend/src/logos.ts", "role": "Default application-logo selection from the bundled catalogue." },
        { "path": "frontend/src/components/PortalShell.tsx", "role": "Authenticated shell: header, sidebar, routes; fetches teams." },
        { "path": "frontend/src/components/Sidebar.tsx", "role": "Primary navigation, including data-driven team buttons." },
        { "path": "frontend/src/components/HomeView.tsx", "role": "Home page: shared vs. owned applications." },
        { "path": "frontend/src/components/TeamView.tsx", "role": "Per-team application list resolved from the URL slug." },
        { "path": "frontend/src/components/SettingsView.tsx", "role": "Settings tabs: Application Manager, User Management, Teams, General Settings." },
        { "path": "frontend/src/components/ApplicationManager.tsx", "role": "Create/edit applications, approval actions, reverse-proxy push." },
        { "path": "frontend/src/components/UserManagement.tsx", "role": "Admin user management and team assignment." },
        { "path": "frontend/src/components/TeamManagement.tsx", "role": "Admin team management: create, rename, icon, reorder, delete." },
        { "path": "frontend/src/components/GeneralSettings.tsx", "role": "Branding and reverse-proxy configuration forms." },
        { "path": "frontend/src/components/AuditView.tsx", "role": "Admin audit-log viewer." },
        { "path": "frontend/src/lib", "role": "Helpers: links, image resize, clipboard, password." },
        { "path": "frontend/public/team-icons", "role": "Bundled team-icon SVG catalogue (generic-IT and cybersecurity sets)." },
        { "path": "frontend/public/logos", "role": "Bundled default application-logo SVG catalogue." }
      ]
    },
    {
      "id": "cli",
      "type": "cli",
      "path": "appmanager-lite",
      "description": "Lifecycle manager: provisions deps (uv sync, npm install), builds the frontend when stale, and runs/stops/inspects the server.",
      "language": "Bash",
      "entrypoint": "./appmanager-lite"
    },
    {
      "id": "scripts",
      "type": "scripts",
      "path": "scripts",
      "description": "Developer verification scripts.",
      "language": "Bash",
      "keyModules": [
        { "path": "scripts/check.sh", "role": "Backend byte-compile + frontend type-check." },
        { "path": "scripts/test.sh", "role": "Backend pytest + frontend vitest." },
        { "path": "scripts/security-check.sh", "role": "Brand-genericization scan, ignore hygiene, dependency audits." }
      ]
    }
  ],
  "techStack": {
    "languages": ["Python", "TypeScript", "Bash"],
    "datastore": "SQLite",
    "backend": {
      "runtime": "Python >=3.11",
      "packageManager": "uv",
      "dependencies": [
        "fastapi>=0.116",
        "starlette>=1.0.1",
        "uvicorn[standard]>=0.30,<0.35",
        "argon2-cffi>=23.1,<24",
        "authlib>=1.3,<2",
        "python3-saml>=1.16,<2",
        "python-multipart>=0.0.20,<1",
        "pydantic>=2.7,<3"
      ],
      "devDependencies": ["pytest>=9.0.3,<10", "httpx>=0.27,<0.29"]
    },
    "frontend": {
      "runtime": "Node.js + npm",
      "packageManager": "npm",
      "buildTool": "Vite",
      "dependencies": ["react@^18.3.1", "react-dom@^18.3.1", "react-router-dom@^6.26.2"],
      "devDependencies": [
        "typescript@^5.5.4",
        "vite@^8.0.16",
        "vitest@^4.1.8",
        "@vitejs/plugin-react@^5.0.0",
        "@testing-library/react@^16.0.1",
        "@testing-library/jest-dom@^6.5.0",
        "@testing-library/user-event@^14.5.2",
        "jsdom@^25.0.1",
        "@types/react@^18.3.5",
        "@types/react-dom@^18.3.0"
      ]
    }
  },
  "commands": [
    { "id": "install-prerequisites", "command": "sudo ./appmanager-lite install", "description": "Install the minimal prerequisites: uv (for the invoking user, via the official installer) and Node.js/npm (via the OS package manager). Requires root/sudo; the portal itself runs as a normal user.", "cwd": ".", "category": "setup" },
    { "id": "lifecycle-start", "command": "./appmanager-lite start", "description": "Provision, build, and start the server (default 127.0.0.1:8000).", "cwd": ".", "category": "lifecycle" },
    { "id": "lifecycle-dev", "command": "./appmanager-lite start --dev", "description": "Run in the foreground with auto-reload.", "cwd": ".", "category": "lifecycle" },
    { "id": "lifecycle-stop", "command": "./appmanager-lite stop", "description": "Stop the background server.", "cwd": ".", "category": "lifecycle" },